id;character;origin_dialogue;translated_dialogue
CABD001RA;Raz;Dogen! Are you okay? I had the strangest machine-induced dream about you!;โดแกน! นายไม่เป็นไรนะ? ฉันฝันแปลก ๆ เกี่ยวกับนายแล้วก็เครื่องจักร 
CABD002DO;Dogen;TV?;ทีวี?
CABD003RA;Raz;Well, first of all, Sasha Nein invited me down to his SECRET LAB and--;"ก็ ตอนแรก ซาช่า ไนน์ เชิญฉันไปที่ ""ห้องทดลองลับ"" ของเขาและ--"
CABD005RA;Raz;He's completely brainless!;เขาสมองกลวงไปแล้ว!
CABD006RA;Raz;The dream was true!;ความฝันเป็นจริง!
CABD007RA;Raz;Dogen, don't worry. I know where your brains are. They're in... like, this crazy, dream-thorn-bush-straight-jacket-tower place.;โดแกน ไม่ต้องห่วง ฉันรู้ว่าสมองนายอยู่ที่ไหน มันอยู่ที่...ที่เหมือนหอคอย-มีหนาม-ปกคลุม-ในฝัน โครตจะบ้า
CABD008DO;Dogen;Hackey sack?;ก้อนไหมพรม?
CABD009RA;Raz;You go to the TV lounge. I'm on the case. I just need a little more advanced training to prepare?;นายไปห้องทีวีก่อนนะ ฉันจัดการเอง ฉันแค่ต้องฝึกขั้นสูงเพิ่มเติมอีกนิดหน่อยเพื่อเตรียมตัว
CAJI015FO;Ford;You'd better hurry on up there. Morry's already started in on those kids. Can't you hear 'em screaming?;
CAJI016FO;Ford;Nothing like the sound of kids screamin' bloody murder on a hot summer day, eh?;
CALD001RA;Raz;Lili!;ลิลี่!
CALD002LI;Lili;Oh, hey Raz.;โอ้ เฮ้ แรซ
CALD003LI;Lili;Listen, I made you something. It's kind of stupid, but--;ฟังนะ ฉันทำอะไรบางอย่างมาให้ มันอาจดูโง่นะ แต่--
CALD004RA;Raz;They stole Dogen's brains!;พวกนั้นขโมยสมองโดแกนไป!
CALD005LI;Lili;No, he's just like that.;ไม่อ่ะ หมอนั่นก็เป็นแบบนั้นอยู่แล้ว
CALD006RA;Raz;I had a nightmare where this mad scientist guy said he was going to take them out and--;ฉันฝันร้าย เห็นนักวิทยาศาสตร์บ้าบอกว่ากำลังจะเอาสมองไปและ--
CALD007LI;Lili;Was it a creepy-looking freak with a shower cap and a stainless steel, three pronged claw?;เขาเหมือนตัวประหลาดน่าขนลุกสวมหมวกอาบน้ำและมีมือกรงเล็บสแตนเลสสามแฉกหรือเปล่า?
CALD008RA;Raz;Hey! That's MY nightmare!;"เฮ้ นั่นฝันร้ายของ ""ฉัน"" นี่"
CALD009LI;Lili;So it's not just me?;งั้นก็ไม่ได้มีแค่ฉัน
CALD010RA;Raz;But how? And why all the meat?;แต่ ได้ไง? และทำไมถึงมีแต่เนื้อ?
CALD011LI;Lili;I don't know, but I think it's time I find out where this is coming from.;ฉันไม่รู้ แต่ฉันคิดว่ามันถึงเวลาที่ฉันต้องไปหาสาเหตุแล้ว
CALD012RA;Raz;Once I get trained in Levitation I'll be able to see the rest of the nightmare and get more information.; หากฉันฝึกการลอยตัวเสร็จเมื่อไร ฉันจะกลับไปดูฝันร้ายที่เหลือเผื่อจะได้ข้อมูลอะไรมากขึ้น
CALD013LI;Lili;Let's rendezvous tonight at the old boathouse for debriefing.;พบกันคืนนี้ที่โรงเรือเก่าเพื่อแลกเปลี่ยนข้อมูลกัน
CALD014RA;Raz;This is so cool.;นี่มันโคตรเจ๋ง 
CALD015LI;Lili;"Yeah, it feels like that time in ""True Psychic Tales"" 314 where--";ใช่ เหมือนกับใน ?True Psychic Tales? เล่มที่ 314 ตอนที่--
CALD016RA;Raz;What did you just say?;เธอว่าไงนะ?
CALD017LI;Lili;Shut up!;หุบปากไปเลย!
CALK001RA;Raz;Bobby! Uh-oh. Look, I can explain--;บ๊อบบี้! เอ่อ ฟังนะ ฉันอธิบายได้--
CALK003BZ;Bobby;TV??;ทีวี??
CALK004BZ;Bobby;TV!;ทีวี!
CALK005LI;Lili;Ahh-choo!;ฮัดชิ่ว!
CALK006RA;Raz;Geez, it sounds like you caught a bad cold.;ตายละ ดูเหมือนเธอจะเป็นหวัดนะ
CALK007LI;Lili;Maybe, but LISTEN! I traced the psychic interference back to Coach Oleander's radio!;อาจจะ แต่ ?ฟังนะ? ฉันแกะรอยคลื่นรบกวนพลังจิตกลับไปที่วิทยุของโค้ชโอลีแอนเดอร์
CALK008LI;Lili;He's been broadcasting his insane plot all over camp in his sleep!;เขากระจายเสียงแผนการบ้า ๆ ไปทั่วค่ายตอนที่เขาหลับอยู่
CALK009RA;Raz;So he's really kidnapping children and stealing their brains to make weapons!;แล้วก็เป็นเขาจริง ๆ ที่ลักพาตัวเด็ก ๆ และขโมยสมองพวกนั้นไปสร้างอาวุธ
CALK010LI;Lili;Yes! Isn't that great?;ใช่ เยี่ยมไปเลยใช่ไหม?
CALK011RA;Raz;What? How is that great?;อะไรนะ? เยี่ยมตรงไหน?
CALK012LI;Lili;Because this is an honest-to-goodness psychic emergency!;"เพราะว่านี้คือเหตุฉุกเฉินด้านพลังจิต""ของจริง"" เลยไงล่ะ!"
CALK013RA;Raz;"And Sasha's not here! He left on some ""official Psychonauts business.""";และซาช่าก็ไม่อยู่ เขาออกไปทำ ?ธุระทางการของไซโคนอท? อะไรสักอย่าง
CALK014LI;Lili;Milla left a note saying the same thing!;มิลล่าก็ทิ้งโน๊ตที่บอกแบบนั้นเหมือนกัน
CALK015RA;Raz;Lili, a deranged madman is building an army of psychic death tanks to take over the world, and there's no one who can stop him except for you and me!;ลิลี่ มีคนบ้าวิกลจริตกำลังจะสร้างกองทัพรถถังพลังจิตมรณะเพื่อยึดครองโลก และไม่มีใครจะหยุดเขาได้นอกจากเธอกับฉัน
CALK016LI;Lili;Oh my god!;โอ้พระเจ้า!
CALK017LI;Lili;Let's make out!;Make out กันเถอะ!
CALK018RA;Raz;Uh, what??;เอ่อ ไงนะ??
CALK019LI;Lili;Sorry! I'm just so excited!;โทษที ฉันแค่ตื่นเต้นมากไปหน่อยน่ะ!
CALK020LI;Lili;Since you showed up, Raz, things are so much more exciting!;ตั้งแต่นายปรากฎตัว แรซ ก็มีเรื่องน่าตื่นเต้นเกิดขึ้นมากมาย!
CALK021LI;Lili;Sinister death plots! Mad scientists!;แผนการชั่วร้าย! นักวิทยาศาสตร์คลั่ง!
CALK022LI;Lili;Hideous monsters!;สัตว์ประหลาดน่าเกลียดน่ากลัว!
CALK023RA;Raz;Make out?;Make out เหรอ?
CALK024LI;Lili;How long have I ignored what this camp had to offer? Everything's new to me now thanks to you! I mean, look at this flower!;นานแค่ไหนแล้วที่ฉันไม่ได้สนใจสิ่งที่ค่ายนี้มี ตอนนี้ทุกอย่างมันแปลกใหม่ขึ้นมากสำหรับฉัน ต้องขอบคุณนาย ฉันหมายถึง ดูดอกไม้นี่สิ
CALK025RA;Raz;You mean, like... kiss?;เธอหมายถึง...จูบเหรอ?
CALK026LI;Lili;How many years have I been coming here and I've never even noticed a cool flower like this before?;กี่ปีมาแล้ว ที่ฉันมาค่ายนี้แต่ก็ไม่เคยสังเกตุเห็นแม้แต่ดอกไม้แสนสวยนี่มาก่อน?
CALK027RA;Raz;Ahhhh--ooof!;Ahhhh--ooof!
CALK028LI;Lili;Oh, no! You didn't just hit my boyfriend!;โอ้ ไม่! แกไม่มีสิทธิ์มาแตะต้องแฟนฉันนะ
CALK029RA;Raz;Spit her out! I'm gonna Heimlich you so bad!;คายเธอออกมาซะ! ไม่งั้นแกอ้วกแตกแน่!
CALK030RA;Raz;Lili!!!;ลิลี่!!!
CALP001RA;Raz;Hey, Lili.;เฮ้ ลิลี่
CALP002LI;Lili;Going for the advanced training? What's the rush?;จะไปฝึกขั้นสูงแล้วเหรอ? รีบอะไรขนาดนั้น?
CALP003RA;Raz;Are you kidding? I only have a few days to become a Psychonaut or I lose my shot forever!;ล้อเล่นใช่ไหม? ฉันเหลือเวลาอีกไม่กี่วันเพื่อจะได้เป็นไซโคนอท ไม่อย่างนั้นก็จะเสียโอกาสไปตลอดชีวิต!
CALP004LI;Lili;Look, Raz, I hate to burst your bubble, but the Psychonauts are not what they used to be.;ฟังนะ แรซ ฉันไม่อยากทำลายความฝันนายหรอก แต่ไซโคนอทไม่ได้เป็นอย่างที่เคยเป็นอีกแล้ว
CALP005LI;Lili;Times have changed. The world just doesn't need us anymore.;สิ่งต่างๆ เปลี่ยนไปแล้ว โลกไม่ต้องการเราอีกต่อไป
CALP006RA;Raz;The world does too need Psychonauts!;โลกยังต้องการไซโคนอทอยู่นะ!
CALP007RA;Raz;Right here at this very camp, in fact. I think there are several fishy things that need psychic investigating.;ที่นี่ที่ค่ายแห่งนี้เลยล่ะ ที่จริง ฉันคิดว่ามีเรื่องแปลกๆ หลายอย่างที่ต้องใช้พลังจิตสืบสวน
CALP008LI;Lili;You are so immature!;นายยังเด็กเกินไป!
CALP009LI;Lili;And cute! When are you gonna just shut up and kiss me?;แถมยังน่ารักอีกด้วย! เมื่อไรนายจะหยุดพูดแล้วมาจูบฉันสักที?
CALP010RA;Raz;Shut up and do what?;หยุดพูดแล้วทำอะไรนะ?
CALP011LI;Lili;Oh. I didn't know you could--uh, I gotta go. Bye.;โอ้ ฉันไม่รู้ว่านายพูดถึง... เอ่อ ฉันต้องไปแล้ว บาย
CALP012LI;Lili;So embarrassing!;น่าอายชะมัด!
CALU002RA;Raz;Gah!;อ้า!
CALU003RA;Raz;Hey, was that you? Looking at me?;เฮ้ นั่นเธอใช่ไหม? ที่มองฉันอยู่?
CALU004LI;Lili;Maybe you should try getting over yourself? There were a lot of other people on that stage besides you.;บางทีนายควรจะเลิกคิดถึงแต่ตัวเองได้แล้วนะ? บนเวทีตอนนั้นมีคนอื่นอีกตั้งเยอะนอกจากนาย
CALU005RA;Raz;No, just now. In the woods.;ไม่ หมายถึงตอนนี้ ในป่า
CALU006RA;Raz;(sniff sniff);(ดมๆ)
CALU007RA;Raz;No, it must have been something else.;ไม่ใช่แฮะ ต้องเป็นอย่างอื่นแน่เลย
CALU008RA;Raz;You don't smell like pond scum.;เธอไม่ได้มีกลิ่นเหม็นเหมือนตะไคร่น้ำ
CALU009LI;Lili;Nice. You should write greeting cards.;เยี่ยม นายน่าจะไปเขียนการ์ดอวยพรนะ
CALU010LI;Lili;Hey, if you want to cut class later, try these smelling salts.;
CALU011LI;Lili;They'll pop you out of anyone's mind and back to the real world before you can say, Crud! That hurts my nose!;
CALU012RA;Raz;Out of anyone's mind?;
CALU013LI;Lili;You'll find out.;
CALU014LI;Lili;Now, mush! We don't want you to be late for class!;
CALU015RA;Raz;Why do you care if I'm late for class?;
CALU016LI;Lili;Because the late thing is MY thing. Don't copy.;
CALU017RA;Raz;There was some sort of shadowy being out there... lurking... watching...;มีอะไรบางอย่างตะคุ่มๆ อยู่ข้างนอก... แอบซ่อนอยู่... กำลังเฝ้ามอง...
CALU018LI;Lili;I know of only one creature who fits that description. It likes to hide in dark places, silently watching unsuspecting children from a distance.;ฉันรู้จักสัตว์ประหลาดแค่ตัวเดียวที่ลักษณะตามที่นายเล่าเป๊ะ มันชอบซ่อนตัวในที่มืดๆ เฝ้ามองเด็กๆ ที่ไม่ทันระวังตัวจากระยะไกล
CALU019RA;Raz;Really? Who?;จริงเหรอ? คัวอะไร?
CALU020LI;Lili;You, tree sitter!  Hahahaha!;นายไง ไอ้คนรักษ์ต้นไม้! ฮ่าๆๆๆๆ!
CASR001BN;Benny;Way to make us look bad in there! You're in trouble now! Bobby Zilch ain't happy.;แกทำพวกเราดูแย่ในนั้น! แกมีปัญหาแน่! บ๊อบบี้ ซิลช์ ต้องไม่พอใจ
CASR002BZ;Bobby;You better watch yourself, Gogglicious.;แกควรระวังตัวไว้หน่อยนะ ก๊อกกี้
CASR003RA;Raz;What's that, Hair Boy? You want a piece of me?;ว่าไง หัวฟู? นายอยากลองของกับฉันเหรอ?
CASR004LI;Lili;Hey, brainiacs. Settle down.;เฮ้ พวกทึ่ม เงียบๆ กันหน่อย
CASR005BZ;Bobby;Why? You worried I'm gonna hurt your boyfriend?;ทำไม? กลัวว่าฉันจะทำร้ายแฟนเธอเหรอ?
CASR006LI;Lili;No. Because Sasha Nein is standing right behind you.;เปล่า เพราะซาช่า ไนน์ กำลังยืนอยู่หลังนายน่ะสิ
CASR007SA;Sasha;Your performance, young cadet, was outstanding. I'd like you to report to my lab for some advanced training.;ทักษะของเธอน่าทึ่งมาก นักเรียนน้อย ฉันอยากให้เธอมารายงานตัวที่ห้องแล็บของฉันเพื่อการฝึกขั้นสูง
CASR008BZ;Bobby;"Oooh! Raz the Spaz is gonna be in the ""special"" class. Benny, remind me to give him a ""special"" beating later, okay?";"โอ้! ไอ้บ้าแรซ จะได้เข้าคลาส ""พิเศษ"" แล้ว. เบนนี่ เตือนฉันเรื่องจัดหนัก""พิเศษ"" มันทีหลังด้วยนะ"
CASR009SA;Sasha;These tests are unauthorized, though, so I can't actually ask you to come. But if you happened to drop in, well, what could I do? Let me just give you this...;แต่การทดสอบนี้ไม่ได้รับอนุญาต ดังนั้นฉันจึงไม่สามารถขอให้เธอมาได้ แต่ถ้าเธออยากจะแวะมาเอง ฉันจะทำอะไรได้ล่ะ? ฉันขอให้สิ่งนี้กับเธอ...
CASR010SA;Sasha;Remember:;จำไว้นะ
CASR011SA;Sasha;Your talent will always set you apart, Razputin.;พรสวรรค์ของเธอจะทำให้เธอโดดเด่นเสมอ แรซปูติน
CASR012SA;Sasha;Sometimes isolation is a good thing. It can lead to important discoveries.;บางครั้ง การปลีกวิเวกก็เป็นสิ่งที่ดี มันจะนำไปสู่การค้นพบครั้งสำคัญ
CASR013RA;Raz;Wait, I don't even know where your lab is! Is this some kind of test?;เดี๋ยว ผมยังไม่รู้ด้วยซ้ำว่าห้องแล็บของคุณอยู่ที่ไหน! นี่เป็นการทดสอบแบบนึงเหรอ?
CASR015RA;Raz;And now I'm hearing things. Great.;แล้วตอนนี้ฉันก็หูแว่วไปเอง เยี่ยม
INBB001RA;Raz;Coach! Out in the woods! I saw--;
INBB002CO;Coach;You're late, Soldier!;นายมาสายนะ ทหาร!
INBB003CO;Coach;Get in here and give me twenty!;เข้ามาในนี้และเอามายี่สิบ!
INBB004RA;Raz;Sir! We need to get a containment team in the area STAT!;ท่าน! เราต้องการหน่วยปิดล้อมในพื้นที่ โดยด่วน!
INBB005RA;Raz;I've spotted a U.P.E.;ผมพบพวก U.P.E. 
INBB006CO;Coach;A U.P.E.?;พวก U.P.E.เรอะ?
INBB007RA;Raz;Yes, an Unregistered Paranormal Entity, possibly aquatic in nature...;" ""สิ่งเหนือธรรมชาติที่ไม่ได้จดทะเบียน"" (Unregistered Paranormal Entity) อาจมีอยู่ในแหล่งน้ำตามธรรมชาติ..."
INBB008CO;Coach;I know what a U.P.E. is, son. I just don't know how YOU know.;ฉันรู้ว่า U.P.E. คืออะไร ไอ้หนู! ฉันแค่ไม่รู้ว่า นายไปรู้มาได้ยังไง
INBB009RA;Raz;"From ""True Psychic Tales"" Issue 424, sir!";"จาก ""True Psychic Tales"" เล่มที่ 424 ท่าน!"
INBB010RA;Raz;Where Sasha Nein fought that clairvoyant grizzly bear?;ตอนที่ ซาช่า ไนน์ ต่อสู้กับหมีกริซลี่ที่มีตาทิพย์?
INBB011CO;Coach;Pah! Comic books!;เฮอะ! หนังสือการ์ตูน!
INBB012RA;Raz;This thing was real, and huge, and--and it smelled all smelly!;เรื่องจริงนะ มันตัวใหญ่ และ--และมันก็มีกลิ่นเหม็นเต็มไปหมด!
INBB013CO;Coach;Save your fish stories for the boathouse, boy.;เอาเรื่องเล่าชาวประมงไปเก็บโรงเรือซะ ไอ้หนู
INTR001CO;Coach;The human mind.;จิตใจของมนุษย์.
INTR002CO;Coach;Six hundred miles of synaptic fiber, five and a half ounces of cranial fluid, fifteen hundred grams of complex neural matter...;มีเส้นประสาทยาวกว่าหกร้อยไมล์, ของเหลวในกระโหลกกว่า ห้ากับอีกครึ่งปอนด์, ระบบประสาทสุดซับซ้อนกว่าอีกพันห้าร้อยกรัม... 
INTR003CO;Coach;A three pound pile of dreams.;กองความฝันอีกสามปอนด์.
INTR004CO;Coach;But I'll tell you what it really is.;แต่ความจริงที่ฉันจะบอกก็คือ
INTR005CO;Coach;It is the ultimate battlefield--and, the ultimate weapon.;มันเป็นสุดยอดสนามรบ--และเป็นสุดยอดอาวุธ.
INTR006CO;Coach;The wars of this modern age--The Psychic Age--are all fought somewhere between these damp, curvaceous undulations.;สงครามในยุคใหม่นี้ --ยุคแห่งจิตใจ-- ล้วนเกิดขึ้นภายในรอยหยักชื้นแฉะแสนคดเคี้ยวนี้
INTR007CO;Coach;AND YOU! DO YOU KNOW WHAT YOU REALLY ARE?;แล้วพวกนาย! รู้ไหมว่าพวกนายเป็นอะไรกันแน่?
INTR008CO;Coach;Well. I'll tell you that too.;ก็ได้ ฉันจะบอกนายด้วย
INTR009CO;Coach;From this day forward, you are all Psychic Soldiers.;นับแต่นี้ไปพวกแกคือ ทหารพลังจิต.
INTR010CO;Coach;Paranormal Paratroopers!;พลร่มเหนือมนุษย์!
INTR011CO;Coach;Mental Marines who are about to ship out on the adventure of their lives!;นาวิกแห่งจิตใจ ออกเรือผจญภัยในชีวิต!
INTR012CO;Coach;THIS IS OUR BEACHHEAD.;นี่ คือ ชายฝั่ง ของเรา
INTR013CO;Coach;And this is your landing craft!;และนี่คือเรือจู่โจมของพวกนาย!
INTR014CO;Coach;You shall engage the enemy in his own mentality! You shall chase his dreams, you shall fight his demons, you shall live his nightmares!;นายจะต้องเผชิญหน้ากับศัตรูในจิตใจของมัน! ไล่ตามความฝันของมัน ใช้ชีวิตในฝันร้ายของมัน!
INTR015CO;Coach;And those of you who fight well, you will find yourselves on the path to becoming international secret agents. In other words...;และผู้ที่ทำได้ดี นายอาจได้ค้นพบตัวเองบนเส้นทางแห่งสายลับนานาชาติ หรือเรียกในอีกชื่อนึงว่า...
INTR016CO;Coach;Psychonauts!;ไซโคนอท!
INTR017CO;Coach;The rest of you... WILL DIE.;ส่วนพวกนายที่เหลือก็... ตาย!
INTR018DO;Dogen;Waaaaaaaa!;แงงงงงง!
INTR019SA;Sasha;Oh, Morry.;โถ่ มอร์รี.
INTR020MI;Milla;Children, you are not going to die.;เด็กน้อย หนูจะไม่ตายหรอกจ้ะ.
INTR021CO;Coach;Well, if you're not a Psychonaut, then you might as well be dead!;ก็ถ้านายไม่ได้เป็นไซโคนอท ก็เหมือนกับนายตายไปแล้ว!
INTR022DO;Dogen;They told me this was a Summer Camp!;พวกเขาบอกฉันว่านี่เป็นแค่ค่ายฤดูร้อน!
INTR023LI;Lili;Ah, Dogen. Don't worry about ol' Coach Oleander. I've been coming here for years, and trust me--nothing ever happens.;โดแกน อย่าไปกังวลเรื่องโค้ชโอลีแอนเดอร์พูดเลย. ฉันมาที่นี่หลายปีแล้ว เชื่อฉัน--มันไม่มีอะไรหรอก.
INTR024BZ;Bobby;Yeah, Dogen. Lili's right. You don't got nothin' to worry about... 'cept for that giant monster in the lake I was telling you about.;ช่าาย, โดแกน ลีลี่พูดถูก. นายไม่ต้องกังวลอะไรหรอก... ยกเว้นสัตว์ประหลาดยักษ์ในทะเลสาบที่ฉันบอก
INTR025CO;Coach;Bobby Zilch! I told you to stop scaring people with that ridiculous, old legend!;บ๊อบบี้ ซิลช์! ฉันบอกแล้วไงว่าหยุดทำให้คนกลัวด้วยตำนานไร้สาระนั่นได้แล้ว
INTR026CO;Coach;I don't want the kids to be afraid to go out at night and walk alone on the perfectly safe paths of Whispering Rock Psychic Summer Camp.;ฉันไม่อยากให้เด็ก ๆ ต้องกลัวที่จะออกไปข้างนอกในเวลากลางคืนและเดินคนเดียวบนเส้นทางที่ปลอดภัยสมบูรณ์แบบของค่ายฝึกพลังจิตฤดูร้อน Whispering Rock แห่งนี้
INTR027CO;Coach;And we don't want to scare our special guests, superstar Psychonauts Sasha Nein and Milla Vodello!;และเราก็ไม่ต้องการทำให้แขกพิเศษของเรากลัวเช่นกัน! ไซโคนอทซูเปอร์สตาร์ ซาช่า ไนน์ และ มิลล่า โวเดลโล!
