id;character;origin_dialogue;translated_dialogue
CAES001EL;Elka;I know! Isn't it just too romantic?;ฉันก็รู้! มันโรแมนติกเกินไปหน่อยไหมเนี่ย?
CAES002EL;Elka;I just hope James won't be too crushed.;ฉันแค่หวังว่าเจมส์จะไม่เสียใจมากเกินไปนะ
CAES003NI;Nils;Shh. You promised--no talking.;ชู่ว์ สัญญาแล้วนี่นาว่าจะไม่คุย
CAES004NI;Nils;Kinda busy.;กำลังยุ่ง ๆ หน่อย
CAET000EL;Elka;Oh my god!;โอ้ พระเจ้า!
CAET001RA;Raz;I know!;รู้แล้ว!
CAET002EL;Elka;I mean, OH  MY GOD!;หมายถึง โอ้ว พระเจ้าช่วย!
CAET004EL;Elka;NILS!!!;นีลส์!!!
CAEU000RA;Raz;Um, he's still in the... uh... oh never mind.;อืม เขายังอยู่ใน... เอ่อ... ช่างมันเถอะ
CAEV000DO;Dogen;...and so I'm really sorry for not believing you.;...แล้วฉันก็เสียใจจริง ๆ ที่ไม่เชื่อเธอนะ
CAEV001DO;Dogen;...right, yeah--that too. I should really not have blown so many of you up. I just get so confused sometimes.;...ใช่ ถูกแล้ว เรื่องนั้นด้วย ฉันไม่น่าระเบิดพวกเธอไปเยอะขนาดนั้นเลย บางทีฉันก็แค่สับสนน่ะ
CAEW000MP;Milka;Is Elton okay?;เอลตันโอเคไหม?
CAEW001RA;Raz;Yeah, he's waiting for you down by the docks.;อืม เขารอเธออยู่ตรงท่าเรือน่ะ
CAEW002MP;Milka;Gotcha.;รับทราบ
CAEW004RA;Raz;Typical.;ตามเคย
CAEX000RA;Raz;Well, he'll be fully brained soon, I promise.;เดี๋ยวเขาก็มีสมองกลับมาเต็มที่ในเร็ว ๆ นี้ ฉันสัญญา
CAEX001MP;Milka;When he comes out, tell him I'm waiting for him down by the docks, okay?;ตอนเขาออกมาแล้ว บอกเขาด้วยนะว่าฉันรอเขาอยู่ตรงท่าเรือ โอเค๊?
CAEY000EF;Elton;Is Milka okay?;มิลก้าโอเคไหม?
CAEY001RA;Raz;Yeah, she's waiting for you down by the docks.;อืม เธอกำลังรอเธออยู่ตรงท่าเรือน่ะ
CAEY003RA;Raz;Is making out all anyone thinks about in this place?;การจู๋จี๋คือสิ่งที่ทุกคนคิดถึงในที่นี้เหรอเนี่ย?
CAEZ000RA;Raz;Well, she'll be fully brained soon, I promise.;เดี๋ยวเธอก็มีสมองกลับมาเต็มที่ในเร็ว ๆ นี้ ฉันสัญญา
CAEZ001EF;Elton;Well, when she comes out, tell her I'm waiting for her down by the docks, okay?;ตอนเธอออกมาแล้ว บอกเธอด้วยนะว่าฉันรอเธออยู่ตรงท่าเรือ โอเค๊?
CAFA000KI;Kitty;Well, there's only one thing that can make this better:;คือว่า มีแค่สิ่งเดียวที่จะทำให้มันดีขึ้นได้:
CAFA001KI;Kitty;Pedicure. See ya.;ทำเล็บเจล ไปนะ
CAFB000FA;Franke;Well, I can tell you one thing.;คือว่า ฉันบอกอะไรให้เธอได้เลยอย่างนึง
CAFB001FA;Franke;My dad is NEVER going to send me to this camp again.;พ่อของฉันจะไม่มีวันส่งฉันมาที่แคมป์นี้อีกแน่นอน
CAFB002FA;Franke;Where's Kitty? Never mind. I'll find her.;คิตตี้อยู่ไหนนะ? ช่างเถอะ เดี๋ยวฉันไปหาเอง
CAFC000MH;Mikhail;Well, if Brain Tank come after Mikhail, it will be sorry.;ถ้าเจ้าถังสมองนั่นตามมาเล่นงานมิคาอิล มันจะต้องเสียใจแน่
CAFC001MH;Mikhail;Better go find tiny boss, see what is plan.;ไปหาเจ้านายตัวเล็กดีกว่า ดูว่าเขามีแผนอะไร
CAFD000MH;Mikhail;Tell me, is tiny boss alive?;บอกหน่อย เจ้านายตัวเล็กรอดไหม?
CAFD001RA;Raz;Yes, and he'll be getting his brain back really soon.;ใช่ และเขากำลังจะได้สมองคืนในเร็ว ๆ นี้แล้ว
CAFD002MH;Mikhail;Ah, good. I take advantage of time off to find bear. ;อ่า ดี ฉันจะใช้เวลาว่างไปตามหาหมี
CAFE000MF;Maloof;Now wire the other end to the gas tank.;ต่อสายไฟอีกด้านเข้ากับถังแก๊ส
CAFE001MF;Maloof;Oh, hello Razputin.;โอ้ สวัสดี แรซปูติน
CAFE002RA;Raz;What are you guys doing?;พวกเธอกำลังทำอะไรกัน?
CAFE003MF;Maloof;Taking care of business. The fewer questions you ask, the better.;จัดการธุระ ยิ่งถามน้อยเท่าไหร่ยิ่งดี
CAFF000MF;Maloof;Sounds like it's time something bad happened to our fine Coach.;ฟังดูเหมือนถึงเวลาที่เรื่องร้าย ๆ จะเกิดขึ้นกับโค้ชสุดหล่อของเราแล้วนะเนี่ย
CAFF002MF;Maloof;Please. You have your plan. I have mine.;เถอะน่า เธอมีแผนของเธอ ฉันก็มีของฉัน
CAFF004MF;Maloof;Say no more.;ไม่ต้องพูดอะไรอีกแล้ว
CAFG002RA;Raz;Do away with yourselves?;กำจัดตัวเองเหรอ?
CAFH000CF;Crystal;O-M-G.  I feel so stupid for throwing myself off the roof now!;โอ้ มายก๊อด ตอนนี้ฉันรู้สึกโง่มากเลยที่กระโดดลงมาจากหลังคา!
CAFH001RA;Raz;What? Why'd you throw yourself off the roof?;อะไรนะ? ทำไมเธอถึงกระโดดลงมาจากหลังคา?
CAFH002CF;Crystal;Because the poison didn't work!;ก็เพราะว่ายาพิษมันไม่ได้ผลไงล่ะ!
CAFH003CF;Crystal;Listen, I have to go. The world could use some major league cheering right about now!;ฟังนะ ฉันต้องไปแล้ว ตอนนี้โลกต้องการกำลังใจครั้งใหญ่เลยล่ะ!
CAFI000JT;J.T.;Well shut mah mouth. I'd better go patrol the livin' quarters. Guard the womenfolk 'n' all.;ให้ตายสิ ฉันว่าฉันไปลาดตระเวนที่พักดีกว่า ไปปกป้องผู้หญิง ๆ น่ะ
CAFI001JT;J.T.;Say, is my hombre walking around yet?;นี่ ไอ้หนุ่มของฉันเดินไปไหนมาไหนได้รึยัง?
CAFI002RA;Raz;Not yet, but soon!;ยังเลย แต่เร็ว ๆ นี้แน่นอน!
CAFI003JT;J.T.;I just hope he forgives me for actin' like such a dang fool.;ฉันแค่หวังว่าเขาจะยกโทษให้ฉันที่ทำตัวโง่ ๆ แบบนั้น
CAFJ000RA;Raz;Yep. He's free-range.; เขาสบาย ๆ
CAFK000JT;J.T.;It's time to circle the wagons, partner. That's the best plan right now.;ถึงเวลาตั้งรับแล้วเพื่อน นั่นคือแผนที่ดีที่สุดตอนนี้
CAFK001JT;J.T.;I'm busy patrollin' the homestead.;ฉันกำลังยุ่งกับการลาดตระเวนอยู่
CAFK002JT;J.T.;With my partner Chops ridin' shotgun!;โดยมีเพื่อนซี้ของฉันช็อปส์คอยคุ้มกันให้!
CAFL000JT;J.T.;I just wish Chops was here to ride shotgun!;ฉันแค่อยากให้ช็อปส์มาคอยคุ้มกันให้จริง ๆ!
CAFM000CP;Chops;You know, I'll bet if J.T. wasn't so distracted, this wouldn't have happened. ;รู้ไหม ฉันพนันเลยว่าถ้าเจ.ที.ไม่วอกแวกมากขนาดนี้ เรื่องแบบนี้คงไม่เกิดขึ้น
CAFM001CP;Chops;He's probably with that prissy little show pony right now.;ตอนนี้เขาคงจะอยู่กับม้าน้อยขี้โอ่นั่นล่ะ
CAFM002RA;Raz;No, actually I think her mind's on other things at the moment.;ไม่ จริง ๆ แล้วฉันว่าตอนนี้เธอคงกำลังคิดถึงเรื่องอื่นอยู่
CAFM003CP;Chops;Hm. Well maybe I'll go see what's up. One of us at least should be guarding the sleeping quarters.;หืม งั้นฉันไปดูหน่อยดีกว่า อย่างน้อยพวกเราคนนึงก็ควรจะเฝ้ายามที่พัก
CAFN000CH;Chloe;Okay, here's the plan. I'm going to get on the Coach's radio, and call for help.;โอเค นี่คือแผน ฉันจะใช้วิทยุของโค้ชโทรขอความช่วยเหลือ
CAFN001RA;Raz;See, now, that's an excellent idea! Why can't everyone be so helpful?;เห็นไหม นี่แหละไอเดียดี! ทำไมทุกคนไม่ทำตัวมีประโยชน์แบบนี้บ้างนะ?
CAFN002CH;Chloe;Yeah, I modified the antenna so now it broadcasts straight into outer space!;ใช่ ฉันดัดแปลงเสาอากาศแล้ว ตอนนี้มันส่งสัญญาณตรงไปยังอวกาศเลย!
CAFN003RA;Raz;Oh man.;โอ้ ให้ตายสิ
CAFO000RA;Raz;...yes, and because you got your brain stolen and I didn't, yes. I do. I think I'm better than you.;...ใช่ และเพราะว่าเธอโดนขโมยสมองไปแต่ฉันไม่โดน ใช่ ฉันคิดว่าฉันเก่งกว่าเธอ
CAFO001BZ;Bobby;Ah ha! I knew it! ;อ๊ะ ฮ่า! ฉันรู้แล้ว!
CAFO002BZ;Bobby;Well, you're wrong!;เธอน่ะคิดผิดแล้ว!
CAFO003BZ;Bobby;Have fun dying!;ขอให้สนุกกับการตายนะ!
CAFP000BN;Benny;Hmm. So does the Coach... does he have an evil sidekick?;หืม แล้วโค้ช... เขามีลูกน้องปีศาจไหมนะ?
CAFP001BN;Benny;A yes man, or a lickspittle?;คนคอยเออออ หรือคนประจบสอพลอ?
CAFP002BN;Benny;Anything?;มีอะไรไหม?
CAFP003RA;Raz;Not sure. Why?;ไม่แน่ใจ ทำไมเหรอ?
CAFP004BN;Benny;Uh, no reason. Bye!;อืม ไม่มีอะไร ไปแล้ว!
CAFQ000PH;Phoebe;Oh, man. I just want to burn that Coach!;โอ้ ให้ตายสิ ฉันแค่อยากจะเผาโค้ชนั่น!
CAFQ001PH;Phoebe;Hey, where's Quentin?;นี่ เควนตินอยู่ไหน?
CAFR000RA;Raz;We're going to be re-braining him really soon.;เรากำลังจะใส่สมองให้เขาในเร็ว ๆ นี้
CAFR001PH;Phoebe;I have to go hit something. Tell him I went to go hit stuff, okay?;ฉันต้องไปทุบอะไรสักอย่าง บอกเขาด้วยว่าฉันไปทุบของ โอเค๊?
CAFS000RA;Raz;He's waiting for you at band practice.;เขากำลังรอเธออยู่ตรงซ้อมดนตรี
CAFS001PH;Phoebe;He better not be painting the wrong band name on my drums again!;เขาอย่ามาทาสีชื่อวงผิด ๆ บนกลองของฉันอีกนะ!
CAFT000QU;Quentin;Wow. That is so not chill.;ว้าว มันไม่เจ๋งเลยอ่ะ
CAFT001QU;Quentin;Hey, where's Phoebe?;นี่ ฟีบี้อยู่ไหน?
CAFT002RA;Raz;We're gonna be re-braining her really soon.;เรากำลังจะใส่สมองให้เธอในเร็ว ๆ นี้
CAFT003QU;Quentin;Well, when she comes out, she's going to want to hit stuff. I'd better go wait by her drums.;ตอนเธอออกมาแล้ว เธอคงอยากจะทุบอะไรสักอย่าง ฉันไปรออยู่ข้างกลองของเธอดีกว่า
CAFU000RA;Raz;She's waiting for you at band practice.;เธอกำลังรอเธออยู่ตรงซ้อมดนตรี
CAFU001QU;Quentin;Awesome. Okay, check you out later, my bros.;สุดยอด โอเค เจอกันนะเพื่อน
CAFV000FO;Ford;Listen, you gotta help. You gotta kill me, son. I can't take the cheering anymore. ;ฟังนะ เธอต้องช่วยหน่อย เธอต้องฆ่าฉัน แรซ ฉันทนเสียงเชียร์ไม่ไหวแล้ว
CAFV001RA;Raz;I'm sorry I put their brains back. Maybe a bear will get them soon.;ผมเสียใจที่ใส่สมองให้พวกเขา บางทีหมีอาจจะมาจัดการพวกเขาเร็ว ๆ นี้ก็ได้
CAFV002FO;Ford;Maybe. If not, you gotta find my drain cleaner and pour it down my throat, okay?;อาจจะ ถ้าไม่ เธอต้องไปหายาล้างท่อของฉันแล้วกรอกลงคอฉัน โอเค๊?
CAFW000RA;Raz;Mr. Cruller, there's a big mess that you gotta help me clean up!;คุณครอลเลอร์ มีเรื่องวุ่นวายใหญ่โตที่คุณต้องช่วยผมจัดการ!
CAFW001FO;Ford;Really? Where? I'll get the jet!;จริงเหรอ? ที่ไหน? ฉันจะไปเอายานเจ็ต!
CAFW002RA;Raz;People are missing, kids' brains have been stolen, Coach Oleander is trying to take over the world...;คนหายตัวไป สมองของเด็ก ๆ ถูกขโมย โค้ชโอลีแอนเดอร์กำลังจะยึดครองโลก...
CAFW003FO;Ford;Aw psh! Not my kind of mess.;โอ๊ย ไม่ใช่เรื่องของฉันสักหน่อย
CAFW004RA;Raz;Won't you help?;ไม่ช่วยหน่อยเหรอ?
CAFW005FO;Ford;I'm a janitor. Let me know when somebody drops a carton of eggs or something.;ฉันเป็นภารโรง บอกฉันก็ต่อเมื่อใครทำไข่แตกก็แล้วกัน
CAFX000RA;Raz;Admiral, sir! Did you hear that? The Hideous Hulking Lungfish of Lake Oblongata just kidnapped Lili!;ท่านพลเรือเอก! ได้ยินรึยัง? ไอ้ปลาปอดอัปลักษณ์แห่งทะเลสาบออบลองกาต้าเพิ่งลักพาตัวลิลี่ไป!
CAFX001FO;Ford;LUNGFISH?!;ปลาปอดงั้นเรอะ?!
CAFX002FO;Ford;So THAT'S what's been tearing up my canoes!;งั้นนั่นสินะที่ทำลายเรือแคนูของฉัน!
CAFX003FO;Ford;Well, I know just what to do!;เอาล่ะ ฉันรู้แล้วว่าจะทำยังไง!
CAFX004RA;Raz;You do? Great!;จริงเหรอ? เยี่ยมเลย!
CAFX005FO;Ford;Yeah, I've got some lungfish-proof shellac. I'll just slap on a fresh coat, maybe two, and that's that!;ใช่ ฉันมียูรีเทนกันปลาปอด เดี๋ยวทาเคลือบมันหน่อย สักรอบสองรอบก็จบเรื่อง!
CAFX006RA;Raz;Admiral, the monster is still out there, and Coach Oleander is trying to take over the world!;ท่านพลเรือเอก สัตว์ประหลาดยังอยู่ข้างนอก แล้วโค้ชโอลีแอนเดอร์ก็กำลังจะยึดครองโลก!
CAFX007FO;Ford;Ah, yes, the world is a crazy place, son. But don't worry.;อ่า ใช่ โลกมันบ้าไปแล้ว แรซ แต่ไม่ต้องห่วง
CAFX008FO;Ford;The canoes are safe.;เรือแคนูปลอดภัยดี
CAFY000RA;Raz;Mr. Cruller, you gotta help! Kids are getting kidnapped, and everyone's missing, and their brains are stolen, and I think the Coach is trying to take over the world with Psychically-armed death tanks!;คุณครอลเลอร์ ช่วยหน่อยเถอะ! เด็ก ๆ ถูกลักพาตัว คนหายไปหมด สมองของพวกเขาถูกขโมย แล้วผมคิดว่าโค้ชกำลังจะยึดครองโลกด้วยรถถังติดอาวุธพลังจิต!
CAFY001FO;Ford;Well, now you see what happens when you go to parts of the forest that are off limits? ;เห็นรึยังว่าเกิดอะไรขึ้นเมื่อเธอเข้าไปในป่าที่ห้ามเข้าน่ะ?
CAFY002FO;Ford;I'm a Ranger. I've got enough problems wrangling these leaves! Now git!;ฉันเป็นคนดูแลป่า ฉันมีปัญหามากพอแล้วกับการจัดการใบไม้พวกนี้ ไปเลยไป๊!
CAFZ000DO;Dogen;Wow, I guess that's what those squirrels were trying to tell me.;ว้าว ฉันว่านั่นคือสิ่งที่พวกกระรอกพยายามจะบอกฉัน
CAFZ001RA;Raz;Huh?;หือ?
CAFZ002DO;Dogen;"They kept saying, ""The tiny man is going to kill everyone.""";"พวกมันพูดอยู่เรื่อย ๆ ว่า ""คนตัวเล็กกำลังจะฆ่าทุกคน"""
CAFZ003DO;Dogen;I thought they were talking about me!;ฉันคิดว่าพวกมันกำลังพูดถึงฉัน!
CAFZ004DO;Dogen;Oh man. I have to go apologize.;โอ้ ให้ตายสิ ฉันต้องไปขอโทษ
CADD005RA;Raz;Hmm. Looks like one of the buttons is missing.;อืม ดูเหมือนว่าปุ่มอันนึงจะหายไป
CADD006RA;Raz;Call me crazy, but I have a weird feeling that the button Sasha gave me goes here.;จะว่าฉันบ้าก็ได้นะ แต่ฉันรู้สึกแปลก ๆ ว่าปุ่มที่ซาช่าให้ฉันมามันน่าจะติดตรงนี้
CADD007RA;Raz;Heh heh heh.;เหอะ ๆ ๆ
CAZE005TO;System;Move RIGHT /Joystick/ to look around.;เลื่อนจอยสติ๊ก/ขวาเพื่อมองไปรอบ ๆ
CAGA000FO;Ford;Okay, quick eye exam before we start.;โอเค ตรวจสายตาด่วน ๆ ก่อนเริ่มกันนะ
CAGA002FO;Ford;Look over that way if you will. ;มองไปทางนั้นหน่อยสิ
CAGA004FO;Ford;No, that way.;ไม่ใช่ ทางนั้นต่างหาก
CAGA005FO;Ford;Look over there.;มองไปทางนู้น
CAGA006FO;Ford;Over there.;ทางนู้นน่ะ
CAGA007FO;Ford;Clocks a-tickin', Sonny!;เวลามีจำกัดนะหนุ่ม!
CAGA008RA;Raz;Wow, what's that?;ว้าว นั่นอะไรน่ะ?
CAGA009FO;Ford;That's a PSI CHALLENGE MARKER. The staff scatters these all over the camp to test the students. Every one of these you find advances you a whole rank.;นั่นคือป้ายท้าทายพลังจิต เจ้าหน้าที่เอาพวกนี้มาวางไว้ทั่วแคมป์เพื่อทดสอบนักเรียน ทุก ๆ อันที่เธอเจอจะทำให้เธอเลื่อน Rank 
CAGA010RA;Raz;Ah ha...;อ่า ฮะ...
CAGA011FO;Ford;Now, look up for me if you will.;ตอนนี้มองขึ้นไปให้ฉันหน่อยสิ
CAZE006TO;System;Move right thumbstick [vertical joystick icon] to look up.;เลื่อนก้านอนาล็อกขวา [รูปจอยสติ๊กแนวตั้ง] เพื่อมองขึ้นด้านบน
CAGA013FO;Ford;Up. Up there.;ขึ้นไป ขึ้นไปข้างบนนั่น
CAGA014FO;Ford;Come on.;เร็วเข้า
CAGA015FO;Ford;You see where I'm pointing?;เห็นที่ฉันชี้ไหม?
CAGA016RA;Raz;Hmmm...;อืมมม...
CAGA017FO;Ford;Some of the old markers have fallen apart. You'll find bits of 'em flapping around loose.;ป้ายเก่าๆ บางอันมันพังไปหมดแล้วน่ะ เธอคงเจอเศษๆ ของมันปลิวว่อนอยู่แถวๆ นี้แหละ
CAGA018FO;Ford;If you find enough of these PSI CARDS, you can put 'em together to make a brand new Challenge Marker...;ถ้าเธอเจอ PSI Card พวกนี้มากพอ ก็เอามาประกอบกันเป็นป้าย Challenge อันใหม่ได้เลย...
CAGA019FO;Ford;...But you have to buy a PSI CORE at the camp store to hold them together.;...แต่ต้องซื้อ PSI CORE จากร้านค้าในแคมป์มาใช้ยึดมันไว้ด้วยกันนะ
CAGA020FO;Ford;Keep ranking up and before you know it you'll be able to use brand new psychic powers. Stuff you didn't even know you could do. ;เลื่อน Rank ไปเรื่อยๆ ไม่ทันไรก็ได้พลังจิตใหม่ๆ แล้ว พลังที่เธอไม่เคยรู้มาก่อนว่าทำได้
CAGA021RA;Raz;And then when do I become a Psychonaut? ;แล้วเมื่อไหร่ผมถึงจะได้เป็น ไซโคนอท สักที?
CAGA022RA;Raz;Because I have to do that before my dad shows up to take me home...;เพราะผมต้องเป็นให้ได้ ก่อนพ่อจะมารับ...
CAGA023RA;Raz;Hey, where'd he go?;เฮ้, เขาไปไหนแล้วน่ะ?
CAGA024RA;Raz;That guy looked so familiar...;หน้าคุ้นๆ จัง...
CAGB000VE;Vernon;Hey, why are you trying to firestart me, Raz?;เฮ้, แรซ จะจุดไฟเผาฉันทำไมน่ะ?
CAGB001NI;Nils;Don't be a dork. Go burn something else.;อย่าทำตัวงี่เง่า ไปเผาอย่างอื่นไป๊
CAGB002EL;Elka;If you don't stop trying to burn me right now I am going to SCREAM!;ถ้าไม่หยุดพยายามเผาฉันเดี๋ยวนี้นะ ฉันจะกรี๊ดให้ลั่นเลย!
CAGB004MP;Milka;Quit it!;เลิกได้แล้ว!
CAGB005KI;Kitty;Go burn someone who cares.;ไปเผาคนที่เขาสนใจเถอะ
CAGB006FA;Franke;Stop trying to burn me, creep!;เลิกพยายามเผาฉันสักที ไอ้โรคจิต!
CAGB007MH;Mikhail;Thanks, but I am warm enough in my thick, Russian hat.;ขอบใจ, แต่ฉันอุ่นพอแล้วกับหมวกขนสัตว์หนาๆ ของรัสเซีย
CAGB008MF;Maloof;This burning choice you've made is a poor one, Razputin.;การตัดสินใจเผาเนี่ย เป็นทางเลือกที่แย่มากนะ แรซปูติน
CAGB009LI;Lili;Is this how you tell girls you have a crush on them? It's annoying.;นี่เป็นวิธีบอกสาวว่าชอบเหรอ? น่ารำคาญนะ
CAGB010CM;Clem;Right on, Raz! You learned firestarting! Good for you!;เยี่ยมไปเลย แรซ! เรียนจุดไฟได้แล้ว! เก่งมาก!
CAGB011CF;Crystal;Hee hee hee! Yay! Firestarting practice! Woo!;ฮี่ๆๆ! เย้! ฝึกจุดไฟ! วู้!
CAGB012JT;J.T.;Move along, little doggy. Nothin' to burn here.;หลีกไปหน่อย ไอ้หนู ไม่มีอะไรให้เผาแถวนี้หรอก
CAGB013CP;Chops;Careful, eh? My hair goes up in flames and we're all goners.;ระวังหน่อยเพื่อน! ผมฉันติดไฟ พวกเแรซวยแน่
