id;character;origin_dialogue;translated_dialogue
CACJ119QU;Quentin;Thanks, man. Hey, do you have a lighter? Cuz if you lit it and held it up right now, that would be rad.;ขอบใจ เพื่อน เฮ้ เธอมีไฟแช็กไหม? เพราะถ้าเธอจุดไฟแล้วชูมันขึ้นตอนนี้ มันจะเจ๋งมากเลย
CACJ120PH;Phoebe;And completely insensitive to me and my issues.;แล้วมันก็ไม่เห็นใจฉันกับปัญหาของฉันเลยสักนิด
CACJ121QU;Quentin;"Oh, right! Right! Uh, never mind. I forgot about the whole ""fire bad"" thing for a moment.";"โอ้ ใช่ๆ เอ่อ ช่างมันเถอะ ฉันลืมเรื่อง ""ไฟมันไม่ดี"" ไปชั่วขณะนึงน่ะ"
CACK122RA;Raz;Drum solo! Wooo!;โซโล่กลอง! วู้!
CACK123QU;Quentin;You heard the man.;ได้ยินที่เขาพูดแล้วนะ
CACL124RA;Raz;Hey, what's the name of the band?;เฮ้ วงชื่ออะไรน่ะ?
CACL125PH;Phoebe;The Firestarters!;นักจุดไฟ!
CACL126QU;Quentin;The Levitators.;นักลอยตัว
CACL127QU;Quentin;Let's not fight in front of the fans, okay?;อย่าทะเลาะกันต่อหน้าแฟนเพลงเลย โอเคไหม?
CACL128PH;Phoebe;Let's not.;อย่าเลย
CACM129QU;Quentin;Kitty... oh kitty...;คิตตี้... โอ้ คิตตี้...
CACM130QU;Quentin;Girl...;ที่รัก...
CACM131QU;Quentin;Oooohhh-ooohohhhhooo.;อู้-โอฮู-โอ้
CACM132QU;Quentin;Kitty!;คิตตี้!
CACM133QU;Quentin;Kittay!;คิทเทย์!
CACM134QU;Quentin;Kitty you so fine, girl.;คิตตี้ เธอช่างงดงาม
CACM135QU;Quentin;Yeah yeah yeah!;เย้ๆๆ!
CACM136PH;Phoebe;Switch it up, Quentin. Come on.;เปลี่ยนแนวบ้าง เควนติน เอาน่า
CACM137QU;Quentin;Ms. Bubai. Buuu-uuuu-uuuu-baaaiiiii!;คุณ บูไบ บู-อู-อู-บาย!
CACM138PH;Phoebe;That's not even a song, dude.;นั่นมันไม่ใช่เพลงด้วยซ้ำ เพื่อน
CACM139PH;Phoebe;That's like a weird slowjam.;นั่นมันเหมือนเพลงช้าแปลกๆ
CACM140QU;Quentin;How about this?;แล้วอันนี้ล่ะ?
CACN141QU;Quentin;In the city.;ในเมือง
CACN142QU;Quentin;She's so pretty.;เธอช่างงดงาม
CACN143QU;Quentin;It's a pity.;มันน่าเสียดาย
CACN144QU;Quentin;This little ditty.;เพลงสั้นๆ นี้
CACN145QU;Quentin;My Itty Bitty.;อิตตี้ บิตตี้ของฉัน
CACN146QU;Quentin;Kitty, Kitty!;คิตตี้ คิตตี้!
CACN147QU;Quentin;My perfect fitty!;คู่ที่สมบูรณ์แบบของฉัน!
CACN148QU;Quentin;Makes me all giddy!;ทำให้ฉันมีความสุข
CACN149QU;Quentin;My oven mitty!;ถุงมือเตาอบของฉัน!
CACN150QU;Quentin;I'll never quitty.;ฉันจะไม่เลิกล้ม
CACN151QU;Quentin;So very witty!;ช่างเฉลียวฉลาด
CACN152QU;Quentin;She got no zitty!;เธอไม่มีสิว
CACN153QU;Quentin;Soon, we'll go stitty!;เร็วๆ นี้ พวกเราจะไปซ้อนท้ายกัน!
CAMM026RA;Raz;That looks like fun.;ดูน่าสนุกจัง
CAMM027CH;Chloe;It's work. I'm testing a low-orbit spaceplane design.;มันใช้ได้ ฉันทำการทดสอบเครื่องบินอวกาศสำหรับโคจรระดับต่ำที่ออกแบบขึ้นมา
CAMN028RA;Raz;How's the testing going?;การทดสอบเป็นยังไงบ้าง
CAMN029CH;Chloe;Not now, Raz.;ไม่ใช่ตอนนี้ แรซ
CAMV001RA;Raz;Hey, did you hear that Coach?;เฮ้ ได้ยินไหมโค้ช
CAMV002RA;Raz;I'm gonna get advanced training from Sasha Nein himself!;ผมจะได้ฝึกหลักสูตรขั้นสูงกับ ซาช่า ไนน์ เองเลย
CAMV003CO;Coach;Hey, hey! You stay away from that egghead, you hear me?;เฮ้ๆ นายควรอยู่ให้ห่างเจ้าหัวไข่นั่นไว้ ได้ยินไหม?
CAMV004RA;Raz;Egghead? Permission to speak freely, sir.;เจ้าหัวไข่เหรอ? ขออนุญาติพูดความเห็นผม
CAMV005CO;Coach;Denied. Listen, Private, those scientific jokers, they don't know what it really means to be a Psychonaut. It's about being in the field, not cooped up in some underground lab all day!;ไม่อนุญาติ ฟังนะ พลทหาร พวกจอมอวดสายวิทย์นั่นน่ะ ไม่รู้ความหมายที่แท้จริงของการเป็นไซโคนอทหรอก มันเป็นเรื่องในสนามรบ ไม่ใช่เอาแต่หมกตัวกันอยู่ในแล็ปใต้ดินทั้งวี่ทั้งวัน
CAMV006RA;Raz;It's underground? Ah ha!;ใต้ดินเหรอ? Ah ha!
CAMV007CO;Coach;Don't even think it! That Brain Tumbler contraption of his will turn your mind to mush! I need that brain!;อย่าแม้แต่จะคิด Brain Tumbler ของเจ้านั่น จะทำให้จิตใจของแกเละเป็นโจ๊ก! ฉันต้องใช้สมองนั่น
CAMV008CO;Coach;I mean, YOU need that brain.;ฉันหมายถึง ?นาย? ยังต้องใช้สมองนั่นอยู่
CAMV009CO;Coach;Now, dismissed soldier. I've got some serious thinking to do. Lots of important planning!;เอาล่ะ ทหาร เลิกแถว  ตอนนี้ฉันมีเรื่องสำคัญที่จะต้องคิด. แผนการสำคัญมากมาย
CAMW010RA;Raz;What kind of planning?;แผนอะไรเหรอ?
CAMW011CO;Coach;Huh? What?;หาา? ไงนะ?
CAMW012RA;Raz;What kind of planning are you doing there? In your sleep?;คุณวางแผนอะไรตอนคุณหลับอยู่เหรอโค้ช?
CAMW013CO;Coach;Hey, never assume a soldier is sleeping just because his eyes are closed.;เฮ้ อย่าเข้าใจผิดว่าทหารหลับเพียงเพราะตาของพวกเขาปิดอยู่
CAMW014CO;Coach;Trust me. That tip could save your life someday.;เชื่อฉัน เทคนิคนี้อาจช่วยให้ชีวิตนายอยู่ต่อไปได้อีกวัน
CAMW015RA;Raz;But--;แต่--
CAMX017RA;Raz;Hey, Coach, will you teach me Telekinesis?;เฮ้ โค้ช คุณจะสอน Telekinesis ให้ผมหรือเปล่า?
CAMX018RA;Raz;Hey, Coach, what rank do I have to earn before I learn Clairvoyance?;เฮ้ โค้ช ผมจะต้องได้อันดับเท่าไรถึงจะเรียน ตาทิพย์ได้?
CAMX019RA;Raz;Hey, Coach, what's that radio do?;เฮ้ โค้ช วิทยุนั้นเอาไว้ทำอะไรเหรอ?
CAMX020RA;Raz;Hey, Coach, how do I burn stuff?;เฮ้ โค้ช ผมจะเผาสิ่งของได้ยังไง?
CAMX021RA;Raz;Hey, Coach, hypothetical question: do you guys teach head explosion?;เฮ้ โค้ช คำถามสมมุติ: พวกคุณสอนเรื่องการระเบิดหัวมั้ย?
CAMX022RA;Raz;Hey, Coach, what did you do before you were a head coach?;เฮ้ โค้ช ก่อนที่จะเป็นหัวหน้าโค้ชคุณทำอะไรมา?
CAMX023RA;Raz;Hey, Coach, what's Milla Vodello really like?;เฮ้ โค้ช มิลล่า โวเดลโล่ เป็นยังไงบ้าง?
CAMX024RA;Raz;Hey, Coach, in a life or death battle between Sasha Nein, and a great white shark, where the shark could see the future, and Sasha was blindfolded, who do you think--;เฮ้ โค้ช ในศึกความเป็นคามตาย ระหว่างซาชา ไนน์ กับฉลามขาว ซึ่งฉลามสามารถมองเห็นอนาคตได้ และซาชาถูกปิดตาไว้ คุณคิดว่าใคร--
CAMX025CO;Coach;I told you, Private! I've got a lot of scheming to do here. You're dismissed!;ฉันบอกนายแล้ว พลทหาร! ฉันมีเรื่องต้องทำอีกมากตอนนี้ เลิกแถวได้แล้ว!
CAMY026RA;Raz;Hey, coach! I need to learn Levitation quick!;เฮ้ โค้ช! ผมต้องเรียนรู้การลอยตัวโดยด่วนเลย!
CAMY027CO;Coach;Do I look like a floater to you?;ฉันดูเหมือนคนลอยไปลอยมา ในสายตานายหรือเปล่า?
CAMY028CO;Coach;Vodello gives the Levitation drills out on the docks.;โวเดลโล่ กำลังให้แบบฝึกหัดการลอยตัวอยู่ที่ท่าเรือ
CAMY029CO;Coach;Now, DISMISSED!;"ทีนี้ ""เลิกแถว""!"
CAMZ030RA;Raz;Coach! You'll never believe the stuff I've been doing!;โค้ช! คุณต้องไม่เชื่อแน่ว่าผมทำอะไร!
CAMZ031CO;Coach;Ahhh!;Ahhh!
CAMZ032CO;Coach;Listen, Private!;ฟังนะ พลหทาร!
CAMZ033CO;Coach;I am at a VERY CRITICAL point in my lesson plan.;"ฉันเป็นส่วน ""โครตสำคัญ"" ในแผนการสอนของฉันเอง"
CAMZ034CO;Coach;I've almost got it all put together. I can't be taken off-mission right now, UNDERSTAND?;ฉันเกือบจะจัดการทุกอย่างเสร็จแล้ว ตอนนี้ฉันออกจากภารกิจไม่ได้ เข้าใจไหม?
CAMZ035RA;Raz;Yes, Sir.;ครับผม
CAMZ036CO;Coach;I promise that I'll come for you when I'm ready to really unlock your brain's full potential!;ฉันสัญญาว่าฉันจะเรียกหานาย เมื่อฉันพร้อมที่จะปลดล็อกศักยภาพสมองของนายจริงๆ !
CAMZ037CO;Coach;Now, for the last time, you are DISMISSED, Private!;ตอนนี้ ครั้งสุดท้ายนะ เลิก-แถว พลทหาร!
CANA038CO;Coach;(...mumble...);(...พึมพำ)
CANA043CO;Coach;Charge!;ลุย!
CANA044CO;Coach;...C rations...;...สเบียง...
CANA045CO;Coach;...Short? Who you calling short?...;สั้นเรอะ? นายเรียกใครสั้น?
CANA046CO;Coach;...Aw... little bunnies...;อู้...กระต่ายน้อย
CANA047CO;Coach;...Not with my troop!;ไม่ใช่กองฉัน!
CANA048CO;Coach;...Get up soldier! Walk it off!;ลุกทหาร! เดินไป!
CANA049CO;Coach;...Got to find... the eggs...;ตามหา...ไข่
CANA050CO;Coach;...Careful with the eggs...;ระวัง...ไข่
CANA051CO;Coach;...Go Easter bunny...;ไปเลยกระต่ายอีสเตอร์
CANA052CO;Coach;...Be careful on the way home...;ระวังตอนกลับบ้าน
CANA053CO;Coach;...Don't drop the eggs, under the water...;อย่าปาไข่ลงน้ำ
CANA054CO;Coach;...Give the eggs to you know who...;เอาไข่ไปให้คนที่นายรู้
CANA055CO;Coach;...Can't decorate a cracked egg!;ตกแต่งไข่แตกไม่ได้!
CANA056CO;Coach;...Good bunny...;กระต่ายดี
CANA057CO;Coach;...When we...;-เมื่อเรา-
CANA058CO;Coach;...Put those eggs in their holders...;-ใส่ไข่ลงในภาชนะ-
CANA059CO;Coach;...Then they'll see. They'll all see...;-แล้วพวกเขาจะได้เห็น ทุกคนจะได้เห็น-
CANA060CO;Coach;...See how pretty my eggs are.;-ว่าไข่ของฉันสวยแค่ไหน
CANA061CO;Coach;...Little baby bunny. Run little bunny! Run!;-เจ้าลูกต่ายน้อย วิ่งต่ายน้อย! วิ่งไป!
CANA062CO;Coach;...Papa! No!;...ป๊ะป๊า! ไม่!
CANA063CO;Coach;...Noooooo...;...ไม่
CANA064CO;Coach;...Ohhhh Papa...;โอ้ ป๊ะป็า
CANA065CO;Coach;...Ohhh, Mr. Bunny!;โอ้ มิสเตอร์บันนี่
CANA066CO;Coach;...When my eggs break...;เมื่อไข่ฉันแตก
CANA067CO;Coach;...They'll spread all over the world...;-พวกมันจะแพร่กระจายไปทั่วโลก
CANA068CO;Coach;...Sunny side up...;รุ่งอรุณจะมาถึง
CANA069CO;Coach;...Haha...;�Haha�
CANA070CO;Coach;...Heh-heh...;�Heh-heh�
CANA071CO;Coach;...hmmm...;�hmmm�
CAPL001RA;Raz;Hey, Elka!;เฮ้ เอลก้า!
CAPN004EL;Elka;Why don't you and your little goggles go poke around in someone else's private business?;ทำไมนายและแว่นตาน้อยๆ ของนายไม่ไปยุ่งเรื่องส่วนตัวของคนอื่นล่ะ?
CAPP001RA;Raz;Hey, you guys sound great!;เฮ้ พวกนายดูเยี่ยมมาก!
CAPP002JT;J.T.;Ha-huh, much obliged, pardner.;ฮ่าฮ่า ขอบใจ เพื่อนฝูง
CAQQ010NI;Nils;Oh, YEAH.;Oh, YEAH.
CAQQ011NI;Nils;This is going to be sweet.;ไปได้สวยแน่ ๆ
CAQQ012NI;Nils;Man, I can see EVERYTHING.;"พวก ฉันจะเห็น ""ทุก ๆ อย่าง"""
CAQR013RA;Raz;You know, a nutcracker might be faster.;รู้ไหม ใช้คีมกระเทาะเปลือก น่าจะเร็วกว่านะ
CAQR014NI;Nils;Tonight, when this baby is full of fine ladies, I'm going to see EVERYTHING.;คืนนี้ เมื่อเจ้าหนูนี่เต็มไปด้วยสาว ๆ ฉันก็จะเห็น ?ทุกอย่าง?
CAQR015RA;Raz;How are you going to fill that nut with ladies?;แล้วนายจะเอาสาว ๆ ใส่เข้าไปในไอ้นั่นยังไงล่ะ
CAQR016NI;Nils;No, dude. The girls' cabin. I've got a man on the inside.;ไม่ พวก กระท่อมสาว ๆ ต่างหาก แล้วฉันก็คือชายที่จะไปอยู่ในนั้น 
CAQR017RA;Raz;I get it! You're using Clairvoyance! You grabbed one of the squirrel's nuts and now you're using Clairvoyance on it to form a mental link and see what the squirrel sees!;เข้าใจล่ะ นายจะใช้ ตาทิพย์ (clairvoyance)! นายไปเอาไอ้นั่นของเจ้ากระรอกนั่นมา และตอนนี้นายจะใช้ตาทิพย์เพื่อเชื่อมต่อจิต แล้วเห็นในสิ่งที่กระรอกมองเห็น !
CAQR018NI;Nils;"Um, could you say ""acorns"" instead of ""nuts"" if you repeat that to anybody else?";อืม ตอนไปเล่าให้ใครฟัง นายช่วยเรียก ?ลูกโอ๊ค? แทนคำว่า ?ไอ้นั่น? ทีนะ
CAQR019RA;Raz;Teach me how to do that!;สอนฉันทำบ้างสิ!
CAQR020NI;Nils;Hey, I paid a LITTLE bit of attention in class, but not THAT much.;เฮ้ ฉันตั้งใจเรียนมาแค่?นิดหน่อย? แต่ก็ไม่ได้ ?ขนาดนั้น?
CAQR021NI;Nils;What you need is an expert in Clairvoyance, where I am merely an expert in the ladies.;ที่นายต้องการคือ  ผู้เชี่ยวชาญเรื่องตาทิพย์ ส่วนฉันน่ะ เก่งแต่เรื่องสาวๆ เท่านั้น
CAQS022RA;Raz;Come on! Teach me Clairvoyance.;เถอะน่า! สอนตาทิพย์ฉันหน่อย
CAQS023NI;Nils;Go find an expert! I have no idea how I'm doing this.;ไปหาผู้เชี่ยวชาญเองสิ! ฉันก็ไม่รู้
CAQS024NI;Nils;Now beat it. You're breaking my focus.;ไปให้พ้น นายทำฉันเสียสมาธิ
CAAE016EL;Elka;Do you want to hear something that James--you know, my new boyfriend James--something funny he said?;อยากฟังเรื่องตลกที่เจมส์... เธอรู้นี่นา แฟนใหม่ฉันชื่อเจมส์... เขาพูดไหม?
CAAE017NI;Nils;No.;ไม่
CAAE018EL;Elka;He said--;เขาบอกว่า--
CAAE019NI;Nils;"I said, ""no.""";"ฉันบอกว่า ""ไม่"" "
CAAE020EL;Elka;Oh. Anyway, we were talking to Lili and she's all het up about a monster she thinks she saw in the woods.;โอ้ เอาเถอะ พวกเราคุยกับลิลี่ และเธอก็กำลังโวยวายเรื่องสัตว์ประหลาดที่เธอคิดว่าเห็นในป่า
CAAE021NI;Nils;Het up?;โวยวาย?
CAAE022EL;Elka;"It's Wild West for ""excited.""";"มันเป็นคำแบบคาวบอยสำหรับคำว่า ""ตื่นเต้น"""
CAAE023EL;Elka;James and I spend so much time together, I guess I'm starting to sound like him.;เจมส์กับฉันใช้เวลาด้วยกันมาก, ฉันเดาว่าฉันเริ่มพูดเหมือนเขาแล้วล่ะ
CAAE024NI;Nils;Funny, I talked to Lili last night and she didn't mention anything about a monster.;ตลกดี, ฉันคุยกับลิลี่เมื่อคืน และเธอไม่ได้พูดถึงสัตว์ประหลาดอะไรเลย
CAAE025EL;Elka;Nothing?;ไม่มี?
CAAE026NI;Nils;"Well, she mostly said ""mmm mmm mmm"" because we were letting our mouths do the talking, if you know what I mean.";"อืม, ส่วนใหญ่เธอพูดแค่ ""อืม อืม อืม"" เพราะว่าเรากำลังปล่อยให้ปากทำงาน, ถ้าเธอเข้าใจที่ฉันพูดนะ"
CAAE027EL;Elka;I sure don't. What do you mean?;ไม่เข้าใจเลย เธอหมายความว่าอะไร?
CAAE028NI;Nils;I mean we were making out because we're involved. Romantically.;ฉันหมายความว่าเรากำลังจู๋จี๋กัน เพราะเรากำลังคบกัน แบบโรแมนติก
CAAE029EL;Elka;WHAT? YOU--Wait--She doesn't like you that way.;อะไรนะ? นาย--เดี๋ยวนะ--เธอไม่ได้ชอบนายแบบนั้น
CAAE030EL;Elka;In fact, that's just one of the many ways she doesn't like you.;จริงๆ แล้ว, นั่นเป็นแค่หนึ่งในหลายๆ วิธีที่เธอไม่ชอบนาย
CAAE031EL;Elka;In fact, she doesn't like you, period.;จริงๆ แล้ว, เธอไม่ชอบนาย จบนะ
CAAE032EL;Elka;You're lying about this whole thing, aren't you?;นายกำลังโกหกเรื่องทั้งหมดนี้, ใช่ไหม?
CAAE033NI;Nils;No way. Lili's my new girlfriend.;ไม่มีทาง ลิลี่เป็นแฟนใหม่ฉัน
CAAE034NI;Nils;"Don't ask her though, because it's a secret.  Because... well, the ""because"" is a secret too.";"แต่อย่าไปถามเธอนะ, เพราะมันเป็นความลับ เพราะว่า... อืม, ""เพราะว่า"" ก็เป็นความลับเหมือนกัน"
CAAE035EL;Elka;Oh Nils. I know it hurts, but I have a new boy in my life.;โอ้ นิลส์ ฉันรู้ว่ามันเจ็บ, แต่ฉันมีผู้ชายคนใหม่ในชีวิตแล้ว
CAAE036EL;Elka;A new cowboy. And he's not just a new cowboy, he's a cowman.;คาวบอยคนใหม่ และเขาไม่ใช่แค่คาวบอย, เขาเป็นคนเลี้ยงวัว
CAAE037NI;Nils;I think you have me confused with you.;ฉันคิดว่าเธอสับสนฉันกับตัวเองนะ
CAAE038NI;Nils;I'm so moved on I wrapped around and now I'm back.;ฉันก้าวข้ามไปไกลจนวกกลับมาแล้ว
CAAE039EL;Elka;Whatever you say.;แล้วแต่นายเลย
CAAE040NI;Nils;There's plenty of women where you came from. And other places.;มีผู้หญิงอีกเยอะแยะที่มาจากที่เดียวกับเธอ และที่อื่นๆ ด้วย
CAAE041EL;Elka;Good.;ดี
CAAR012RA;Raz;Hey Elton, have you heard anything else about that thing in the lake?;เฮ้ เอลตัน, นายได้ยินเรื่องอะไรอีกไหมเกี่ยวกับสิ่งนั้นในทะเลสาบ?
CAAR013EF;Elton;Huh? Oh. Not really. The fish are kinda goin' crazy about Bobby and Benny over there torturing anything that swims too close.;หือ? โอ้ ไม่ค่อยนะ พวกปลาน่ะเหมือนจะคลั่งเพราะบ็อบบี้กับเบนนี่ที่อยู่ตรงนั้นทรมานอะไรก็ตามที่ว่ายน้ำใกล้เกินไป
CAAR014EF;Elton;Ohhh, somebody should do something.;โอ้, ใครสักคนควรทำอะไรสักอย่างนะ
CAAR015MP;Milka;Yeah!;ใช่!
CAAR016RA;Raz;Well, I suppose I could go talk to them...;เอ่อ, ฉันคิดว่าฉันควรไปคุยกับพวกเขานะ...
CAAS017RA;Raz;What are the chances that--if I ask nicely--you two will stop messing with those poor fish?;มีโอกาสมากแค่ไหนที่--ถ้าฉันขอดีๆ--นายสองคนจะหยุดแกล้งพวกปลาที่น่าสงสารพวกนี้?
CAAS018BZ;Bobby;About as good as the chance that if you say one more freakin' word to me about fish, the fire department's gonna have to Jaws of Life my fist outta your mouth!;โอกาสดีพอๆ กับโอกาสที่ถ้าแกพูดถึงปลาอีกคำเดียวกับฉันนะ, หน่วยดับเพลิงจะต้องใช้เครื่องตัดถ่างเอากำปั้นฉันออกจากปากแก!
CAAS019RA;Raz;So wait, does that mean you will?;เดี๋ยวก่อนนะ, นั่นหมายความว่าพวกนายจะ...?
CAAS020BZ;Bobby;I will punch you. That's what that means.;ฉันจะต่อยแก นั่นแหละคือความหมายของมัน
CAAS021MP;Milka;I am the Hideous Hulking Lungfish of Lake Oblongata! I can breathe air and love to eat the brains of little boys.;ฉันคือปลาปอดร่างยักษ์น่าเกลียดแห่งทะเลสาบออบลองกาต้า! ฉันหายใจทางอากาศได้และชอบกินสมองของเด็กผู้ชาย
CAAS022BN;Benny;AHHHH!;AHHHH!
CACO001VE;Vernon;Hey guys!;เฮ้ พวกเธอ!
CACO002KI;Kitty;Did you hear something Franke?;ได้ยินอะไรไหม แฟรงกี้
CACO003FA;Franke;Nope.;ไม่
CACO004VE;Vernon;Guys, hey! Hey! It's Vernon. I'm right next to you. Hey!;ทุกคน เฮ้! เฮ้! เวอร์นอนเอง อยู่นี่ข้างๆ พวกเธอเนี่ย เฮ้!
CACO006FA;Franke;What is it, Vernon?;อะไรเหรอ เวอร์นอน?
CACO008KI;Kitty;Stop! We saw them. We saw all of them. Just like five seconds ago.;พอเลย! พวกเราเห็นพวกเขา พวกเราเห็นพวกเขาทั้งหมด เมื่อห้าวิที่แล้วเอง
